{
  "name": "quicksort-general",
  "algorithm": "quicksort",
  "notes": "Deterministic last-element-pivot Lomuto partition (not randomized) for cross-language reproducibility; returns a new array.",
  "ops": [
    { "op": "quickSort", "args": [[5, 3, 8, 1, 9, 2, 7, 4, 6, 0]], "expect": { "value": [0, 1, 2, 3, 4, 5, 6, 7, 8, 9] } },
    { "op": "quickSort", "args": [[4, -1, 0, 4, -1, 9, 2]], "expect": { "value": [-1, -1, 0, 2, 4, 4, 9] } },
    { "op": "quickSort", "args": [[]], "expect": { "value": [] } },
    { "op": "quickSort", "args": [[1, 1, 1, 1]], "expect": { "value": [1, 1, 1, 1] } }
  ]
}
