{
  "name": "reservoir-sampling-mulberry32-seeded",
  "algorithm": "reservoir",
  "notes": "Both languages must use an identical mulberry32 PRNG and identical floor(rng() * (i+1)) draw sequence for a given seed, or these vectors will diverge -- this is the primary cross-language determinism check for the whole lab.",
  "ops": [
    { "op": "reservoirSample", "args": [[0, 1, 2, 3, 4, 5, 6, 7, 8, 9], 3, 42], "expect": { "value": [0, 7, 9] } },
    { "op": "reservoirSample", "args": [["a", "b", "c", "d", "e", "f", "g", "h"], 4, 7], "expect": { "value": ["f", "b", "c", "d"] } },
    { "op": "reservoirSample", "args": [[1, 2, 3], 3, 99], "expect": { "value": [1, 2, 3] } },
    { "op": "reservoirSample", "args": [[1, 2, 3], 0, 99], "expect": { "value": [] } },
    { "op": "reservoirSample", "args": [[1, 2, 3], 5, 1], "error": "invalid" }
  ]
}
